"The Torch Is Passed: A Harding Family Story",1,£19.09,In stock
"The Mindfulness and Acceptance Workbook for Anxiety: A Guide to Breaking Free from Anxiety, Phobias, and Worry Using Acceptance and Commitment Therapy",4,£23.89,In stock
"The Art Forger",3,£40.76,In stock
"On a Midnight Clear",3,£14.07,In stock
"Judo: Seven Steps to Black Belt (an Introductory Guide for Beginners)",2,£53.90,In stock
"Shobu Samurai, Project Aryoku (#3)",3,£29.06,In stock
"Modern Romance",5,£28.26,In stock
"The White Queen (The Cousins' War #1)",5,£25.91,In stock
"The Song of Achilles",5,£37.40,In stock
"The Immortal Life of Henrietta Lacks",2,£40.67,In stock
"The Dovekeepers",1,£48.78,In stock
"More Than Music (Chasing the Dream #1)",2,£37.61,In stock
"Code Name Verity (Code Name Verity #1)",4,£22.13,In stock
"Cell",4,£20.29,In stock
"Angels Walking (Angels Walking #1)",2,£34.20,In stock
"A Series of Catastrophes and Miracles: A True Story of Love, Science, and Cancer",2,£56.48,In stock
"A People's History of the United States",2,£40.79,In stock
"A Brush of Wings (Angels Walking #3)",1,£55.51,In stock
"Rook",4,£37.86,In stock
"The Midnight Watch: A Novel of the Titanic and the Californian",1,£26.20,In stock
"The Gray Rhino: How to Recognize and Act on the Obvious Dangers We Ignore",4,£59.15,In stock
"The Children",3,£11.88,In stock
"One with You (Crossfire #5)",4,£15.71,In stock
"Without Shame",5,£48.27,In stock
"Watchmen",4,£58.05,In stock
"A Hero's Curse (The Unseen Chronicles #1)",3,£50.49,In stock
"23 Degrees South: A Tropical Tale of Changing Whether...",2,£35.79,In stock
"The Glass Castle",1,£16.24,In stock
"The Drowning Girls",3,£35.67,In stock
"Team of Rivals: The Political Genius of Abraham Lincoln",5,£20.12,In stock
"John Adams",4,£57.43,In stock
"Good in Bed (Cannie Shapiro #1)",5,£37.05,In stock
"The Joy of Cooking",4,£43.27,In stock
"The Golden Compass (His Dark Materials #1)",1,£18.77,In stock
"The God Delusion",3,£46.85,In stock
"Pride and Prejudice",4,£19.27,In stock
"Mere Christianity",3,£48.51,In stock
"Fun Home: A Family Tragicomic",4,£56.59,In stock
"The Raven King (The Raven Cycle #4)",2,£30.57,In stock
"Find Her (Detective D.D. Warren #8)",1,£22.37,In stock
"Evicted: Poverty and Profit in the American City",1,£42.27,In stock
"A Game of Thrones (A Song of Ice and Fire #1)",2,£46.42,In stock
"A Clash of Kings (A Song of Ice and Fire #2)",3,£10.79,In stock
"The Tipping Point: How Little Things Can Make a Big Difference",2,£10.02,In stock
"The Rest Is Noise: Listening to the Twentieth Century",1,£34.77,In stock
"The Purpose Driven Life: What on Earth Am I Here for?",3,£37.19,In stock
"The Hitchhiker's Guide to the Galaxy (Hitchhiker's Guide to the Galaxy #1)",3,£47.80,In stock
"The Girl Who Kicked the Hornet's Nest (Millennium Trilogy #3)",1,£57.48,In stock
"The End of Faith: Religion, Terror, and the Future of Reason",4,£22.13,In stock
"The Complete Poems",5,£41.32,In stock
"The Catcher in the Rye",1,£24.55,In stock
"The Case for Christ (Cases for Christianity)",1,£47.84,In stock
"The Blind Side: Evolution of a Game",5,£53.71,In stock
"Seven Days in the Art World",2,£52.33,In stock
"Sarah's Key",1,£46.29,In stock
"Rogue Lawyer (Rogue Lawyer #1)",3,£50.11,In stock
"Manuscript Found in Accra",2,£34.98,In stock
"Fire Bound (Sea Haven/Sisters of the Heart #5)",4,£21.28,In stock
"Cosmos",2,£36.17,In stock
"#GIRLBOSS",1,£50.96,In stock
"The Sense of an Ending",3,£31.38,In stock
"The Republic",3,£33.78,In stock
"The Odyssey",3,£29.64,In stock
"The Light of the Fireflies",1,£54.43,In stock
"The Iliad",1,£16.16,In stock
"The Communist Manifesto",3,£14.76,In stock
"Lord of the Flies",3,£24.89,In stock
