"Worlds Elsewhere: Journeys Around Shakespeare’s Globe",5,£40.30,In stock
"The Five Love Languages: How to Express Heartfelt Commitment to Your Mate",3,£31.05,In stock
"Reasons to Stay Alive",2,£26.41,In stock
"#HigherSelfie: Wake Up Your Life. Free Your Soul. Find Your Tribe.",5,£23.11,In stock
"Unseen City: The Majesty of Pigeons, the Discreet Charm of Snails & Other Wonders of the Urban Wilderness",4,£44.18,In stock
"Throwing Rocks at the Google Bus: How Growth Became the Enemy of Prosperity",3,£31.12,In stock
"The Life-Changing Magic of Tidying Up: The Japanese Art of Decluttering and Organizing",3,£16.77,In stock
"The Gutsy Girl: Escapades for Your Life of Epic Adventure",1,£37.13,In stock
"The Electric Pencil: Drawings from Inside State Hospital No. 3",1,£56.06,In stock
"Spark Joy: An Illustrated Master Class on the Art of Organizing and Tidying Up",4,£41.83,In stock
"Reskilling America: Learning to Labor in the Twenty-First Century",2,£19.83,In stock
"In the Country We Love: My Family Divided",4,£22.00,In stock
"Everydata: The Misinformation Hidden in the Little Data You Consume Every Day",2,£54.35,In stock
"Call the Nurse: True Stories of a Country Nurse on a Scottish Isle",5,£29.14,In stock
"Algorithms to Live By: The Computer Science of Human Decisions",1,£30.81,In stock
"The Power of Now: A Guide to Spiritual Enlightenment",2,£43.54,In stock
"The Omnivore's Dilemma: A Natural History of Four Meals",2,£38.21,In stock
"The Genius of Birds",1,£17.24,In stock
"The Artist's Way: A Spiritual Path to Higher Creativity",5,£38.49,In stock
"So You've Been Publicly Shamed",2,£12.23,In stock
"Daring Greatly: How the Courage to Be Vulnerable Transforms the Way We Live, Love, Parent, and Lead",3,£19.43,In stock
"Big Magic: Creative Living Beyond Fear",3,£30.80,In stock
"Becoming Wise: An Inquiry into the Mystery and Art of Living",2,£27.43,In stock
"Agnostic: A Spirited Manifesto",5,£12.51,In stock
"Whole Lotta Creativity Going On: 60 Fun and Unusual Exercises to Awaken and Strengthen Your Creativity",4,£38.20,In stock
"What's It Like in Space?: Stories from Astronauts Who've Been There",2,£19.60,In stock
"The Year of Magical Thinking",2,£43.04,In stock
"The Literature Book (Big Ideas Simply Explained)",3,£17.43,In stock
"The Bad-Ass Librarians of Timbuktu: And Their Race to Save the World’s Most Precious Manuscripts",1,£15.77,In stock
"Swell: A Year of Waves",1,£45.58,In stock
"No Dream Is Too High: Life Lessons From a Man Who Walked on the Moon",2,£21.95,In stock
"Looking for Lovely: Collecting the Moments that Matter",5,£29.14,In stock
"Let It Out: A Journey Through Journaling",5,£26.79,In stock
"Hamilton: The Revolution",3,£58.79,In stock
"Far & Away: Places on the Brink of Change: Seven Continents, Twenty-Five Years",4,£15.06,In stock
"Eaternity: More than 150 Deliciously Easy Vegan Recipes for a Long, Healthy, Satisfied, Joyful Life",5,£51.75,In stock
"Buying In: The Secret Dialogue Between What We Buy and Who We Are",4,£37.80,In stock
"Brain on Fire: My Month of Madness",5,£49.32,In stock
"Abstract City",5,£56.37,In stock
"13 Hours: The Inside Account of What Really Happened In Benghazi",1,£27.06,In stock
"The Lonely City: Adventures in the Art of Being Alone",2,£33.26,In stock
"The Diary of a Young Girl",3,£59.90,In stock
"Snatched: How A Drug Queen Went Undercover for the DEA and Was Kidnapped By Colombian Guerillas",3,£21.21,In stock
"Furiously Happy: A Funny Book About Horrible Things",4,£41.46,In stock
"The Sleep Revolution: Transforming Your Life, One Night at a Time",4,£11.68,In stock
"Mother, Can You Not?",5,£16.89,In stock
"A Mother's Reckoning: Living in the Aftermath of Tragedy",3,£19.53,In stock
"10% Happier: How I Tamed the Voice in My Head, Reduced Stress Without Losing My Edge, and Found Self-Help That Actually Works",2,£24.57,In stock
"Chernobyl 01:23:40: The Incredible True Story of the World's Worst Nuclear Disaster",2,£35.92,In stock
"Zero to One: Notes on Startups, or How to Build the Future",3,£34.06,In stock
"Why Not Me?",1,£17.76,In stock
"When Breath Becomes Air",2,£39.36,In stock
"The Midnight Assassin: Panic, Scandal, and the Hunt for America's First Serial Killer",4,£28.45,In stock
"Smarter Faster Better: The Secrets of Being Productive in Life and Business",5,£38.89,In stock
"Rising Strong",3,£21.82,In stock
"Man's Search for Meaning",3,£29.48,In stock
"Love That Boy: What Two Presidents, Eight Road Trips, and My Son Taught Me About a Parent's Expectations",2,£25.06,In stock
"Living Forward: A Proven Plan to Stop Drifting and Get the Life You Want",3,£12.55,In stock
"I Will Find You",1,£44.21,In stock
"Brazen: The Courage to Find the You That's Been Hiding",2,£19.22,In stock
"Between the World and Me",4,£56.91,In stock
"Being Mortal: Medicine and What Matters in the End",4,£55.06,In stock
"A Murder Over a Girl: Justice, Gender, Junior High",3,£13.20,In stock
"For the Love: Fighting for Grace in a World of Impossible Standards",3,£45.13,In stock
"Finding God in the Ruins: How God Redeems Pain",2,£46.64,In stock
"The Man Who Mistook His Wife for a Hat and Other Clinical Tales",4,£59.45,In stock
"In Cold Blood",4,£49.98,In stock
"Girl, Interrupted",3,£42.14,In stock
"Why Save the Bankers?: And Other Essays on Our Economic and Political Crisis",2,£48.67,In stock
"Talking to Girls About Duran Duran: One Young Man's Quest for True Love and a Cooler Haircut",4,£25.15,In stock
"My Mother Was Nuts",4,£31.63,In stock
"Data, A Love Story: How I Gamed Online Dating to Meet My Match",3,£32.35,In stock
"The Jazz of Physics: The Secret Link Between Music and the Structure of the Universe",3,£38.71,In stock
"The Gunning of America: Business and the Making of American Gun Culture",4,£16.81,In stock
"The Geography of Bliss: One Grump's Search for the Happiest Places in the World",2,£28.23,In stock
"God Is Not Great: How Religion Poisons Everything",1,£27.80,In stock
"We the People: The Modern-Day Figures Who Have Reshaped and Affirmed the Founding Fathers' Vision of America",3,£31.95,In stock
"Very Good Lives: The Fringe Benefits of Failure and the Importance of Imagination",3,£50.66,In stock
"Unstuffed: Decluttering Your Home, Mind, and Soul",1,£58.09,In stock
"Under the Banner of Heaven: A Story of Violent Faith",1,£30.00,In stock
"Trespassing Across America: One Man's Epic, Never-Done-Before (and Sort of Illegal) Hike Across the Heartland",1,£53.51,In stock
"The Name of God is Mercy",2,£37.25,In stock
"Stiff: The Curious Lives of Human Cadavers",3,£36.74,In stock
"Spilled Milk: Based on a True Story",1,£49.51,In stock
"Rise of the Rocket Girls: The Women Who Propelled Us, from Missiles to the Moon to Mars",4,£41.67,In stock
"Outliers: The Story of Success",1,£14.16,In stock
"Notes from a Small Island (Notes From a Small Island #1)",1,£40.17,In stock
"Night (The Night Trilogy #1)",1,£13.51,In stock
"Miracles from Heaven: A Little Girl, Her Journey to Heaven, and Her Amazing Story of Healing",1,£57.83,In stock
"Letter to a Christian Nation",1,£22.20,In stock
"Let's Pretend This Never Happened: A Mostly True Memoir",1,£45.11,In stock
"It's Never Too Late to Begin Again: Discovering Creativity and Meaning at Midlife and Beyond",1,£42.38,In stock
"Into the Wild",5,£56.70,In stock
"In the Garden of Beasts: Love, Terror, and an American Family in Hitler's Berlin",3,£28.85,In stock
"I Am Malala: The Girl Who Stood Up for Education and Was Shot by the Taliban",2,£28.88,In stock
"Gratitude",5,£26.66,In stock
"Disrupted: My Misadventure in the Start-Up Bubble",5,£15.28,In stock
"Brave Enough",5,£51.32,In stock
"Born to Run: A Hidden Tribe, Superathletes, and the Greatest Race the World Has Never Seen",2,£27.35,In stock
"Blink: The Power of Thinking Without Thinking",5,£21.74,In stock
"Black Flags: The Rise of ISIS",1,£40.87,In stock
"Are We Smart Enough to Know How Smart Animals Are?",1,£56.58,In stock
"A Walk in the Woods: Rediscovering America on the Appalachian Trail",4,£30.48,In stock
"The Suffragettes (Little Black Classics, #96)",2,£11.89,In stock
"Kindle Paperwhite User's Guide",3,£34.00,In stock
"H is for Hawk",5,£57.42,In stock
"Travels with Charley: In Search of America",5,£57.82,In stock
"The Tumor",5,£41.56,In stock
"The End of the Jesus Era (An Investigation #1)",1,£14.40,In stock
"Eat, Pray, Love",3,£51.32,In stock
