"Mesaerion: The Best Science Fiction Stories 1800-1849",1,£37.59,In stock
"Join",5,£35.67,In stock
"William Shakespeare's Star Wars: Verily, A New Hope (William Shakespeare's Star Wars #4)",4,£43.30,In stock
"The Project",1,£10.65,In stock
"Soft Apocalypse",2,£26.12,In stock
"Sleeping Giants (Themis Files #1)",1,£48.74,In stock
"Arena",4,£21.36,In stock
"Foundation (Foundation (Publication Order) #1)",1,£32.42,In stock
"The Restaurant at the End of the Universe (Hitchhiker's Guide to the Galaxy #2)",1,£10.92,In stock
"Ready Player One",4,£19.07,In stock
"Life, the Universe and Everything (Hitchhiker's Guide to the Galaxy #3)",2,£33.26,In stock
"Dune (Dune #1)",1,£54.86,In stock
"Do Androids Dream of Electric Sheep? (Blade Runner #1)",1,£51.48,In stock
"Three Wishes (River of Time: California #1)",2,£44.18,In stock
"The Last Girl (The Dominion Trilogy #1)",2,£36.26,In stock
"Having the Barbarian's Baby (Ice Planet Barbarians #7.5)",4,£34.96,In stock
